{
  "schema_version": "1.0.0",
  "id": "event_reload_007",
  "source_id": "source_001",
  "pts_start_s": 193.12,
  "pts_end_s": 194.47,
  "session_start_s": 193.12,
  "session_end_s": 194.47,
  "event_type": "reload",
  "description": "Empty reload while moving right under approaching threat.",
  "participants": [
    "player",
    "weapon",
    "enemy_group_A"
  ],
  "evidence_ids": [
    "ev_reload_007"
  ],
  "visible_state_before": {
    "ammo": 0,
    "movement": "right"
  },
  "visible_state_after": {
    "ammo": 6,
    "movement": "right"
  },
  "ambiguities": [
    "Input onset not visible."
  ],
  "supersedes": null
}
